{
  "record_type": "cam_assist_review_annotations",
  "record_version": "1.0.0",
  "package_reference": "luthiers-toolbox:vcarve:rosette-001",
  "created_at": "2026-05-28T00:00:00Z",
  "annotations": [
    {
      "annotation_id": "ann-a1b2c3d4-e5f6-7890-abcd-ef1234567890",
      "reviewer": "acoustic-review-agent",
      "jurisdiction": "acoustic_review",
      "timestamp": "2026-05-28T00:00:00Z",
      "severity": "info",
      "category": "acoustic",
      "message": "V-carve rosette pattern maintains minimum 2mm clearance from soundhole edge."
    },
    {
      "annotation_id": "ann-b2c3d4e5-f6a7-8901-bcde-f12345678901",
      "reviewer": "manufacturing-review-agent",
      "jurisdiction": "manufacturing_review",
      "timestamp": "2026-05-28T00:05:00Z",
      "severity": "warning",
      "category": "tooling",
      "message": "V-bit angle (60°) requires slower feed rate for spruce.",
      "recommended_action": "Verify feed rate is reduced to 80% for softwood species."
    },
    {
      "annotation_id": "ann-c3d4e5f6-a7b8-9012-cdef-123456789012",
      "reviewer": "safety-review-agent",
      "jurisdiction": "safety_review",
      "timestamp": "2026-05-28T00:10:00Z",
      "severity": "concern",
      "category": "safety",
      "message": "Carve depth (3.2mm) approaches soundboard thickness limit for this species.",
      "recommended_action": "Confirm soundboard thickness is at least 4.5mm before proceeding."
    }
  ],
  "authority": {
    "annotations_are_informational": true,
    "annotations_do_not_approve": true
  }
}
